{
  "id": "Clusters_m72",
  "category": "clusters",
  "order": 31,
  "canonical_url": "/image_card/Clusters_m72.php",
  "gallery": {
    "title": "Globular Cluster of Aquarius",
    "subtitle": "M72",
    "thumb": "/Images/m72_Combine_100.jpg",
    "alt": "M72"
  },
  "title": "Astrophotography - M72 (Globular Cluster)",
  "object": "M72 (GLOBULAR CLUSTER)",
  "image": {
    "large": "/Images/m72_Combine_2000.jpg",
    "thumb": "/Images/m72_Combine_800.jpg",
    "alt": "M72 (GLOBULAR CLUSTER)",
    "survey": "P/DSS2/color",
    "fov": 25,
    "target": "M72"
  },
  "details": [
    {
      "label": "Object Notes",
      "text": "Constellation: Aquarius\nLocation: RA: 20h 53m 30.0s Dec: -12d 32' 00\" Epoch 2000\nSize: 5.9 arc-minutes\nMagnitude: 9.4\nType: Globular Cluster\nAKA: ngc6981",
      "links": []
    },
    {
      "label": "Instrument",
      "text": "Ritchey-Chretien 32\" Telescope",
      "links": [
        {
          "href": "/Equipment_RC32.php",
          "label": "Ritchey-Chretien 32\" Telescope"
        }
      ]
    },
    {
      "label": "Focal Ratio",
      "text": "f7.2 (prime focus)",
      "links": []
    },
    {
      "label": "Camera",
      "text": "SBIG STL-11000 CCD camera\n(See product review in July, 2004 issue of Sky & Telescope magazine.)",
      "links": [
        {
          "href": "http://www.sbig.com/sbwhtmls/large_format_cameras.htm",
          "label": "SBIG STL-11000 CCD camera"
        }
      ]
    },
    {
      "label": "Exposure",
      "text": "21 x 1 minute Luminance unbinned,\n5 x 1 minute each R/G/B, all binned 3x3",
      "links": []
    },
    {
      "label": "Guiding",
      "text": "Off-Axis with STV Autoguider\n(Santa Barbara Instrument Group)\n(See product review in May, 2003 issue of Astronomy magazine.)\nSee Photo/Guiding Equipment.",
      "links": [
        {
          "href": "http://www.sbig.com",
          "label": "(Santa Barbara Instrument Group)"
        },
        {
          "href": "/Equipment_PhotoGuide.php",
          "label": "Photo/Guiding Equipment."
        }
      ]
    },
    {
      "label": "Date",
      "text": "10/07/04, 10/25/05",
      "links": []
    },
    {
      "label": "Post Processing",
      "text": "CCDSoft, CCDSharp, MaxIM DL, Photoshop CS",
      "links": []
    }
  ],
  "galleries": [
    {
      "category": "clusters",
      "order": 31,
      "link": "image_card/Clusters_m72.php",
      "thumb": "/Images/m72_Combine_100.jpg",
      "alt": "M72",
      "title": "Globular Cluster of Aquarius",
      "subtitle": "M72"
    }
  ]
}
