{
  "id": "Galaxies_ngc3521",
  "category": "galaxies",
  "order": 45,
  "canonical_url": "/image_card/Galaxies_ngc3521.php",
  "gallery": {
    "title": "Intermediate Spiral Galaxy of Leo",
    "subtitle": "NGC3521",
    "thumb": "/Images/ngc3521_050310_100.jpg",
    "alt": "NGC3521"
  },
  "title": "Astrophotography - ngc3521",
  "object": "NGC3521",
  "image": {
    "large": "/Images/ngc3521_050310_2000.jpg",
    "thumb": "/Images/ngc3521_050310_800.jpg",
    "alt": "NGC3521",
    "survey": "P/DSS2/color",
    "fov": 25,
    "target": "NGC3521"
  },
  "details": [
    {
      "label": "Object Notes",
      "text": "Constellation: Leo\nLocation: RA: 11h 05m 48.0s Dec: -00d 02' 00\" Epoch 2000\nSize: 11.2 x 5.4 arc-minutes\nMagnitude: 9.0\nType: Spiral Galaxy\nAKA: UGC 6150",
      "links": []
    },
    {
      "label": "Exposure",
      "text": "12 x 5 minutes Luminance unbinned\n4 x 5 minutes each R/G/B, all unbinned",
      "links": []
    },
    {
      "label": "Date",
      "text": "3/10/05",
      "links": []
    },
    {
      "label": "Post Processing",
      "text": "CCDSoft, CCDSharp, MaxIM DL, Photoshop CS",
      "links": []
    }
  ],
  "galleries": [
    {
      "category": "galaxies",
      "order": 45,
      "link": "image_card/Galaxies_ngc3521.php",
      "thumb": "/Images/ngc3521_050310_100.jpg",
      "alt": "NGC3521",
      "title": "Intermediate Spiral Galaxy of Leo",
      "subtitle": "NGC3521"
    }
  ]
}
