{
  "id": "178ed_ngc2264",
  "category": "178ed",
  "order": 20,
  "canonical_url": "/image_card/178ed_ngc2264.php",
  "gallery": {
    "title": "",
    "subtitle": "NGC2264",
    "thumb": "/Images/ngc2264R_041116_100.jpg",
    "alt": "NGC2264"
  },
  "title": "Astrophotography - ngc2264",
  "object": "NGC2264 (CONE NEBULA REGION)",
  "image": {
    "large": "/Images/ngc2264R_041116_2000.jpg",
    "thumb": "/Images/ngc2264R_041116_800.jpg",
    "alt": "NGC2264 (CONE NEBULA REGION)",
    "survey": "P/DSS2/color",
    "fov": 25,
    "target": "NGC2264"
  },
  "details": [
    {
      "label": "Exposure",
      "text": "10 x 5 minutes Luminance unbinned\n3 x 5 minutes each R/G/B, all binned 3x3",
      "links": []
    },
    {
      "label": "Date",
      "text": "11/16/04",
      "links": []
    },
    {
      "label": "Post Processing",
      "text": "CCDSoft, CCDSharp, MaxIM DL, Photoshop CS",
      "links": []
    }
  ],
  "galleries": [
    {
      "category": "178ed",
      "order": 20,
      "link": "image_card/178ed_ngc2264.php",
      "thumb": "/Images/ngc2264R_041116_100.jpg",
      "alt": "NGC2264",
      "title": "",
      "subtitle": "NGC2264"
    }
  ]
}
