{
  "id": "178ED_m45",
  "category": "178ed",
  "order": 14,
  "canonical_url": "/image_card/178ED_m45.php",
  "gallery": {
    "title": "Pleiades Star Cluster",
    "subtitle": "M45",
    "thumb": "Images/m45R_041116_100.jpg",
    "alt": "M45"
  },
  "title": "Astrophotography - M45 (Pleiades)",
  "object": "M45 (PLEIADES)",
  "image": {
    "large": "/Images/m45R_041116_2000.jpg",
    "thumb": "/Images/m45R_041116_800.jpg",
    "alt": "M45 (PLEIADES)",
    "survey": "P/DSS2/color",
    "fov": 25,
    "target": "M45"
  },
  "details": [
    {
      "label": "Exposure",
      "text": "12 x 5 minutes Luminance unbinned\n3 x 5 minutes each R/G/B, all binned 3x3",
      "links": []
    },
    {
      "label": "Date",
      "text": "11/16/04",
      "links": []
    },
    {
      "label": "Post Processing",
      "text": "CCDSoft, CCDSharp, MaxIM DL, Photoshop CS",
      "links": []
    }
  ],
  "galleries": [
    {
      "category": "178ed",
      "order": 14,
      "link": "/image_card/178ED_m45.php",
      "thumb": "Images/m45R_041116_100.jpg",
      "alt": "M45",
      "title": "Pleiades Star Cluster",
      "subtitle": "M45"
    }
  ]
}
