{
  "id": "178ED_trapezium",
  "category": "178ed",
  "order": 12,
  "canonical_url": "/image_card/178ED_trapezium.php",
  "gallery": {
    "title": "Center of Orion Nebula",
    "subtitle": "Trapezium",
    "thumb": "Images/Trapezium_040913_100.jpg",
    "alt": "Trapezium"
  },
  "title": "Astrophotography - Trapezium (Center of Orion Nebula)",
  "object": "TRAPEZIUM (CENTER OF ORION NEBULA)",
  "image": {
    "large": "/Images/Trapezium_040913_800.jpg",
    "thumb": "/Images/Trapezium_040913_800.jpg",
    "alt": "TRAPEZIUM (CENTER OF ORION NEBULA)",
    "survey": "P/DSS2/color",
    "fov": 25,
    "target": "TRAPEZIUM"
  },
  "details": [
    {
      "label": "Instrument",
      "text": "Meade 178ED 7\" Apochromatic Refractor Telescope",
      "links": []
    },
    {
      "label": "Focal Ratio",
      "text": "f9 (prime focus)",
      "links": []
    },
    {
      "label": "Camera",
      "text": "SBIG STL-11000 CCD camera\n(See product review in July, 2004 issue of Sky & Telescope magazine.)",
      "links": [
        {
          "href": "http://www.sbig.com/sbwhtmls/large_format_cameras.htm",
          "label": "SBIG STL-11000 CCD camera"
        }
      ]
    },
    {
      "label": "Exposure",
      "text": "36 x 1 second Luminance unbinned\n12 x 1 second each R/G/B, all unbinned",
      "links": []
    },
    {
      "label": "Guiding",
      "text": "Off-Axis with STV Autoguider\n(Santa Barbara Instrument Group)\n(See product review in May, 2003 issue of Astronomy magazine.)\nSee Photo/Guiding Equipment.",
      "links": [
        {
          "href": "http://www.sbig.com",
          "label": "(Santa Barbara Instrument Group)"
        },
        {
          "href": "/Equipment_PhotoGuide.php",
          "label": "Photo/Guiding Equipment."
        }
      ]
    },
    {
      "label": "Date",
      "text": "9/13/04",
      "links": []
    },
    {
      "label": "Post Processing",
      "text": "CCDSoft, CCDSharp, MaxIM DL, Photoshop CS",
      "links": []
    }
  ],
  "galleries": [
    {
      "category": "178ed",
      "order": 12,
      "link": "/image_card/178ED_trapezium.php",
      "thumb": "Images/Trapezium_040913_100.jpg",
      "alt": "Trapezium",
      "title": "Center of Orion Nebula",
      "subtitle": "Trapezium"
    }
  ]
}
