{
  "id": "fits_m51",
  "category": "fits",
  "order": 16,
  "canonical_url": "/image_card/fits_m51.php",
  "gallery": {
    "title": "Whirlpool Galaxy",
    "subtitle": "M51",
    "thumb": "Images/m51_050414_100.jpg",
    "alt": "M51"
  },
  "title": "ASTROPHOTOGRAPHY - M51 - WHIRLPOOL GALAXY",
  "object": "M51 - WHIRLPOOL GALAXY",
  "image": {
    "large": "/Images/m51_050414_2000.jpg",
    "thumb": "/Images/m51_050414_100.jpg",
    "alt": "M51 - WHIRLPOOL GALAXY",
    "survey": "P/DSS2/color",
    "fov": 25,
    "target": "M51"
  },
  "details": [
    {
      "label": "Files",
      "text": "m51_050414_15i75mF_L.FIT (Luminance, 75 min, 5-min subs)\nm51_050414_5i25mF_R.FIT (Red, 25 min, 5-min subs)\nm51_050414_5i25mF_G.FIT (Green, 25 min, 5-min subs)\nm51_050414_5i25mF_B.FIT (Blue, 25 min, 5-min subs)",
      "links": [
        {
          "href": "/fits/m51_050414_15i75mF_L.FIT",
          "label": "m51_050414_15i75mF_L.FIT"
        },
        {
          "href": "/fits/m51_050414_5i25mF_R.FIT",
          "label": "m51_050414_5i25mF_R.FIT"
        },
        {
          "href": "/fits/m51_050414_5i25mF_G.FIT",
          "label": "m51_050414_5i25mF_G.FIT"
        },
        {
          "href": "/fits/m51_050414_5i25mF_B.FIT",
          "label": "m51_050414_5i25mF_B.FIT"
        }
      ]
    }
  ],
  "galleries": [
    {
      "category": "fits",
      "order": 16,
      "link": "image_card/fits_m51.php",
      "thumb": "Images/m51_050414_100.jpg",
      "alt": "M51",
      "title": "Whirlpool Galaxy",
      "subtitle": "M51"
    }
  ]
}
