{
  "id": "Clusters_m37",
  "category": "clusters",
  "order": 21,
  "canonical_url": "/image_card/Clusters_m37.php",
  "gallery": {
    "title": "Open Cluster of Auriga",
    "subtitle": "M37",
    "thumb": "/Images/m37_041212_100.jpg",
    "alt": "M37"
  },
  "title": "Astrophotography - M37",
  "object": "M37",
  "image": {
    "large": "/Images/m37_041212_2000.jpg",
    "thumb": "/Images/m37_041212_800.jpg",
    "alt": "M37",
    "survey": "P/DSS2/color",
    "fov": 25,
    "target": "M37"
  },
  "details": [
    {
      "label": "Object Notes",
      "text": "Constellation: Auriga\nLocation: RA: 05h 52m 24.0s Dec: +32d 32' 59\" Epoch 2000\nSize: 24.0 arc-minutes\nMagnitude: 5.6\nType: Open Cluster\nAKA: ngc2099",
      "links": []
    },
    {
      "label": "Instrument",
      "text": "Ritchey-Chretien 32\" Telescope",
      "links": [
        {
          "href": "/Equipment_RC32.php",
          "label": "Ritchey-Chretien 32\" Telescope"
        }
      ]
    },
    {
      "label": "Focal Ratio",
      "text": "f7.2 (prime focus)",
      "links": []
    },
    {
      "label": "Camera",
      "text": "SBIG STL-11000 CCD camera\n(See product review in July, 2004 issue of Sky & Telescope magazine.)",
      "links": [
        {
          "href": "http://www.sbig.com/sbwhtmls/large_format_cameras.htm",
          "label": "SBIG STL-11000 CCD camera"
        }
      ]
    },
    {
      "label": "Exposure",
      "text": "17 x 1 minutes Luminance, 5 x 1 minutes each R/G/B, all unbinned",
      "links": []
    },
    {
      "label": "Guiding",
      "text": "Off-Axis with STV Autoguider\n(Santa Barbara Instrument Group)\n(See product review in May, 2003 issue of Astronomy magazine.)\nSee Photo/Guiding Equipment.",
      "links": [
        {
          "href": "http://www.sbig.com",
          "label": "(Santa Barbara Instrument Group)"
        },
        {
          "href": "/Equipment_PhotoGuide.php",
          "label": "Photo/Guiding Equipment."
        }
      ]
    },
    {
      "label": "Date",
      "text": "12/12/04",
      "links": []
    },
    {
      "label": "Post Processing",
      "text": "CCDSoft, CCDSharp, MaxIM DL, Photoshop CS",
      "links": []
    }
  ],
  "galleries": [
    {
      "category": "clusters",
      "order": 21,
      "link": "image_card/Clusters_m37.php",
      "thumb": "/Images/m37_041212_100.jpg",
      "alt": "M37",
      "title": "Open Cluster of Auriga",
      "subtitle": "M37"
    }
  ]
}
