{
  "id": "Nebulae_pk36m1v1",
  "category": "nebulae",
  "order": 68,
  "canonical_url": "/image_card/Nebulae_pk36m1v1.php",
  "gallery": {
    "title": "Planetary Nebula of Aquila",
    "subtitle": "PK36-1.1",
    "thumb": "/Images/pk36_050907_100.jpg",
    "alt": "PK36-1.1"
  },
  "title": "Astrophotography - pk 36-1.1",
  "object": "PK 36-1.1",
  "image": {
    "large": "/Images/pk36_050907_2000.jpg",
    "thumb": "/Images/pk36_050907_800.jpg",
    "alt": "PK 36-1.1",
    "survey": "P/DSS2/color",
    "fov": 25,
    "target": "Sh2-71"
  },
  "details": [
    {
      "label": "Object Notes",
      "text": "Constellation: Aquila\nLocation: RA: 19h 02m 00.0s Dec: +02d 09' 00\" Epoch 2000\nSize: 124 x 75 arc-seconds\nMagnitude: 13.2\nType: Planetary Nebula\nAKA: Sharpless 2-71 (SH2-71)",
      "links": []
    },
    {
      "label": "Instrument",
      "text": "Ritchey-Chretien 32\" Telescope",
      "links": [
        {
          "href": "/Equipment_RC32.php",
          "label": "Ritchey-Chretien 32\" Telescope"
        }
      ]
    },
    {
      "label": "Focal Ratio",
      "text": "f7.2 (prime focus)",
      "links": []
    },
    {
      "label": "Camera",
      "text": "SBIG STL-11000 CCD camera\n(See product review in July, 2004 issue of Sky & Telescope magazine.)\nwith Astrodon Tru-Balance color filters.",
      "links": [
        {
          "href": "http://www.sbig.com/sbwhtmls/large_format_cameras.htm",
          "label": "SBIG STL-11000 CCD camera"
        },
        {
          "href": "http://www.astrodon.com",
          "label": "Astrodon"
        }
      ]
    },
    {
      "label": "Exposure",
      "text": "6 x 5 minutes Luminance unbinned\n3 x 5 minutes each R/G/B, all unbinned",
      "links": []
    },
    {
      "label": "Guiding",
      "text": "Off-Axis with STV Autoguider\n(Santa Barbara Instrument Group)\n(See product review in May, 2003 issue of Astronomy magazine.)\nSee Photo/Guiding Equipment.",
      "links": [
        {
          "href": "http://www.sbig.com",
          "label": "(Santa Barbara Instrument Group)"
        },
        {
          "href": "/Equipment_PhotoGuide.php",
          "label": "Photo/Guiding Equipment."
        }
      ]
    },
    {
      "label": "Date",
      "text": "9/07/05",
      "links": []
    },
    {
      "label": "Post Processing",
      "text": "CCDSoft, CCDSharp, MaxIM DL, Photoshop CS",
      "links": []
    }
  ],
  "galleries": [
    {
      "category": "nebulae",
      "order": 68,
      "link": "image_card/Nebulae_pk36m1v1.php",
      "thumb": "/Images/pk36_050907_100.jpg",
      "alt": "PK36-1.1",
      "title": "Planetary Nebula of Aquila",
      "subtitle": "PK36-1.1"
    }
  ]
}
