{
  "id": "Galaxies_m91",
  "category": "galaxies",
  "order": 20,
  "canonical_url": "/image_card/Galaxies_m91.php",
  "gallery": {
    "title": "Barred Spiral Galaxy of Coma Berenices",
    "subtitle": "M91",
    "thumb": "/Images/m91_050413_800.jpg",
    "alt": "M91"
  },
  "title": "Astrophotography - M91",
  "object": "M91",
  "image": {
    "large": "/Images/m91_050413_2000.jpg",
    "thumb": "/Images/m91_050413_800.jpg",
    "alt": "M91",
    "survey": "P/DSS2/color",
    "fov": 25,
    "target": "M91"
  },
  "details": [
    {
      "label": "Object Notes",
      "text": "Constellation: Coma Berenices\nLocation: RA: 12h 35m 24s Dec: +14d 30' 00\" Epoch 2000\nSize: 5.2 x 4.2 arc-minutes\nMagnitude: 10.1\nType: Spiral Galaxy\nAKA: ngc4548",
      "links": []
    },
    {
      "label": "Exposure",
      "text": "12 x 5 minutes Luminance unbinned\n3 x 5 minutes each R/G/B unbinned",
      "links": []
    },
    {
      "label": "Date",
      "text": "4/13/05",
      "links": []
    },
    {
      "label": "Post Processing",
      "text": "CCDSoft, CCDSharp, MaxIM DL, Photoshop CS",
      "links": []
    }
  ],
  "galleries": [
    {
      "category": "galaxies",
      "order": 20,
      "link": "image_card/Galaxies_m91.php",
      "thumb": "/Images/m91_050413_800.jpg",
      "alt": "M91",
      "title": "Barred Spiral Galaxy of Coma Berenices",
      "subtitle": "M91"
    }
  ]
}
