{
  "id": "Nebulae_ngc40",
  "category": "nebulae",
  "order": 20,
  "canonical_url": "/image_card/Nebulae_ngc40.php",
  "gallery": {
    "title": "Bow-Tie Nebula",
    "subtitle": "NGC40",
    "thumb": "/Images/ngc40_051026_100.jpg",
    "alt": "NGC40"
  },
  "title": "Astrophotography - ngc40",
  "object": "NGC40",
  "image": {
    "large": "/Images/ngc40_051026_2000.jpg",
    "thumb": "/Images/ngc40_051026_800.jpg",
    "alt": "NGC40",
    "survey": "P/DSS2/color",
    "fov": 25,
    "target": "NGC40"
  },
  "details": [
    {
      "label": "Object Notes",
      "text": "Constellation: Cepheus\nLocation: RA: 00h 13m 0.0s Dec: +72d 32' 00\" Epoch 2000\nSize: 60 x 40 arc-seconds\nMagnitude: 10.7\nType: Planetary Nebula\nAKA: PK 120+9.1",
      "links": []
    },
    {
      "label": "Exposure",
      "text": "9 x 5 minutes Luminance unbinned\n3 x 5 minutes each R/G/B, all unbinned\n6 x 15 minutes Hydrogen-Alpha unbinned",
      "links": []
    },
    {
      "label": "Date",
      "text": "10/26/05",
      "links": []
    },
    {
      "label": "Post Processing",
      "text": "CCDSoft, CCDSharp, MaxIM DL, Photoshop CS",
      "links": []
    }
  ],
  "galleries": [
    {
      "category": "nebulae",
      "order": 20,
      "link": "image_card/Nebulae_ngc40.php",
      "thumb": "/Images/ngc40_051026_100.jpg",
      "alt": "NGC40",
      "title": "Bow-Tie Nebula",
      "subtitle": "NGC40"
    }
  ]
}
