{
  "id": "Clusters_m54",
  "category": "clusters",
  "order": 26,
  "canonical_url": "/image_card/Clusters_m54.php",
  "gallery": {
    "title": "Globular Cluster of Sagittarius",
    "subtitle": "M54",
    "thumb": "/Images/m54_050708_100.jpg",
    "alt": "M54"
  },
  "title": "Astrophotography - M54 (Globular Cluster)",
  "object": "M54 (GLOBULAR CLUSTER)",
  "image": {
    "large": "/Images/m54_050708_2000.jpg",
    "thumb": "/Images/m54_050708_800.jpg",
    "alt": "M54 (GLOBULAR CLUSTER)",
    "survey": "P/DSS2/color",
    "fov": 25,
    "target": "M54"
  },
  "details": [
    {
      "label": "Object Notes",
      "text": "Constellation: Sagittarius\nLocation: RA: 18h 55m 6.0s Dec: -30d 29' 00\" Epoch 2000\nSize: 9.1 arc-minutes\nMagnitude: 7.7\nType: Globular Cluster\nAKA: ngc6715",
      "links": []
    },
    {
      "label": "Exposure",
      "text": "10 x 1 minutes Luminance unbinned\n5 x 1 minutes each R/G/B, all unbinned",
      "links": []
    },
    {
      "label": "Date",
      "text": "7/08/05",
      "links": []
    },
    {
      "label": "Post Processing",
      "text": "CCDSoft, CCDSharp, MaxIM DL, Photoshop CS",
      "links": []
    }
  ],
  "galleries": [
    {
      "category": "clusters",
      "order": 26,
      "link": "image_card/Clusters_m54.php",
      "thumb": "/Images/m54_050708_100.jpg",
      "alt": "M54",
      "title": "Globular Cluster of Sagittarius",
      "subtitle": "M54"
    }
  ]
}
