{
  "id": "Galaxies_Abell1940",
  "category": "galaxies",
  "order": 69,
  "canonical_url": "/image_card/Galaxies_Abell1940.php",
  "gallery": {
    "title": "",
    "subtitle": "ABELL1940",
    "thumb": "/Images/Abell1940_060523_100.jpg",
    "alt": "ABELL1940"
  },
  "title": "Astrophotography - Abell 1940 Galaxy Cluster",
  "object": "ABELL 1940 GALAXY CLUSTER",
  "image": {
    "large": "/Images/Abell1940_060523_2000.jpg",
    "thumb": "/Images/Abell1940_060523_800.jpg",
    "alt": "ABELL 1940 GALAXY CLUSTER",
    "survey": "P/DSS2/color",
    "fov": 25,
    "target": "Abell1940"
  },
  "details": [
    {
      "label": "Object Notes",
      "text": "Constellation: Draco\nLocation: RA: 14h 35m 28s Dec: 55d 08m 48s Epoch 2000\nType: Galaxy Cluster",
      "links": []
    },
    {
      "label": "Exposure",
      "text": "44 x 5 minutes Luminance unbinned\n3 x 5 minutes each R/G/B, all unbinned",
      "links": []
    },
    {
      "label": "Date",
      "text": "May 23, 2006",
      "links": []
    },
    {
      "label": "Post Processing",
      "text": "CCDSoft, CCDSharp, MaxIM DL, Photoshop CS",
      "links": []
    }
  ],
  "galleries": [
    {
      "category": "galaxies",
      "order": 69,
      "link": "image_card/Galaxies_Abell1940.php",
      "thumb": "/Images/Abell1940_060523_100.jpg",
      "alt": "ABELL1940",
      "title": "",
      "subtitle": "ABELL1940"
    },
    {
      "category": "newccd",
      "order": 2,
      "link": "image_card/Galaxies_Abell1940.php",
      "thumb": "/Images/Abell1940_060523_100.jpg",
      "alt": "Abell 1940",
      "title": "",
      "subtitle": "Abell 1940"
    }
  ]
}
