{
  "id": "Nebulae_ngc6960_1",
  "category": "nebulae",
  "order": 39,
  "canonical_url": "/image_card/Nebulae_ngc6960_1.php",
  "gallery": {
    "title": "Veil Nebula",
    "subtitle": "NGC6960",
    "thumb": "/Images/ngc6960_041006_100.jpg",
    "alt": "NGC6960"
  },
  "title": "Astrophotography - ngc6960 (Veil Nebula)",
  "object": "NGC6960 (VEIL NEBULA)",
  "image": {
    "large": "/Images/ngc6960_041006_2000.jpg",
    "thumb": "/Images/ngc6960_041006_800.jpg",
    "alt": "NGC6960 (VEIL NEBULA)",
    "survey": "P/DSS2/color",
    "fov": 25,
    "target": "NGC6960"
  },
  "details": [
    {
      "label": "Object Notes",
      "text": "Constellation: Cygnus\nLocation: RA: 20h 45m 42s Dec: 30d 43h 00s Epoch 2000\nSize: 210 x 160 arc-minutes\nMagnitude: 10.0\nType: Supernova Remnant\nAKA: LBN 191",
      "links": []
    },
    {
      "label": "Instrument",
      "text": "Ritchey-Chretien 32\" Telescope",
      "links": [
        {
          "href": "/Equipment_RC32.php",
          "label": "Ritchey-Chretien 32\" Telescope"
        }
      ]
    },
    {
      "label": "Focal Ratio",
      "text": "f7.2 (prime focus)",
      "links": []
    },
    {
      "label": "Camera",
      "text": "SBIG STL-11000 CCD camera\n(See product review in July, 2004 issue of Sky & Telescope magazine.)",
      "links": [
        {
          "href": "http://www.sbig.com/sbwhtmls/large_format_cameras.htm",
          "label": "SBIG STL-11000 CCD camera"
        }
      ]
    },
    {
      "label": "Exposure",
      "text": "9 x 5 minutes Luminance unbinned,\n3 x 5 minutes each R/G/B, binned 3x3",
      "links": []
    },
    {
      "label": "Guiding",
      "text": "Off-Axis with STV Autoguider\n(Santa Barbara Instrument Group)\n(See product review in May, 2003 issue of Astronomy magazine.)\nSee Photo/Guiding Equipment.",
      "links": [
        {
          "href": "http://www.sbig.com",
          "label": "(Santa Barbara Instrument Group)"
        },
        {
          "href": "/Equipment_PhotoGuide.php",
          "label": "Photo/Guiding Equipment."
        }
      ]
    },
    {
      "label": "Date",
      "text": "10/06/04",
      "links": []
    },
    {
      "label": "Post Processing",
      "text": "CCDSoft, CCDSharp, MaxIM DL, Photoshop CS",
      "links": []
    }
  ],
  "galleries": [
    {
      "category": "nebulae",
      "order": 39,
      "link": "image_card/Nebulae_ngc6960_1.php",
      "thumb": "/Images/ngc6960_041006_100.jpg",
      "alt": "NGC6960",
      "title": "Veil Nebula",
      "subtitle": "NGC6960"
    }
  ]
}
