{
  "id": "Galaxies_m110",
  "category": "galaxies",
  "order": 31,
  "canonical_url": "/image_card/Galaxies_m110.php",
  "gallery": {
    "title": "Satelite of Andromeda",
    "subtitle": "M110",
    "thumb": "/Images/m110_041005_100.jpg",
    "alt": "M110"
  },
  "title": "Astrophotography - m110 (ngc205)",
  "object": "M110 (NGC205)",
  "image": {
    "large": "/Images/m110_041005_2000.jpg",
    "thumb": "/Images/m110_041005_800.jpg",
    "alt": "M110 (NGC205)",
    "survey": "P/DSS2/color",
    "fov": 25,
    "target": "M110"
  },
  "details": [
    {
      "label": "Object Notes",
      "text": "Constellation: Andromeda\nLocation: RA: 00h 40m 22.5s Dec: +41d 41' 11\" Epoch 2000\nSize: 19.5 x 11.5 arc-minutes\nMagnitude: 8.1\nType: Spiral Galaxy\nAKA: ngc205",
      "links": []
    },
    {
      "label": "Exposure",
      "text": "18 x 5 minutes Luminance unbinned\n6 x 5 minutes each R/G/B, all binned 3x3",
      "links": []
    },
    {
      "label": "Date",
      "text": "10/05/04",
      "links": []
    },
    {
      "label": "Post Processing",
      "text": "CCDSoft, CCDSharp, MaxIM DL, Photoshop CS",
      "links": []
    }
  ],
  "galleries": [
    {
      "category": "galaxies",
      "order": 31,
      "link": "image_card/Galaxies_m110.php",
      "thumb": "/Images/m110_041005_100.jpg",
      "alt": "M110",
      "title": "Satelite of Andromeda",
      "subtitle": "M110"
    }
  ]
}
