{
  "id": "Nebulae_m17",
  "category": "nebulae",
  "order": 3,
  "canonical_url": "/image_card/Nebulae_m17.php",
  "gallery": {
    "title": "Omega Nebula",
    "subtitle": "M17",
    "thumb": "/Images/m17_050512_100.jpg",
    "alt": "M17"
  },
  "title": "Astrophotography - M17 (Omega Nebula)",
  "object": "M17 (OMEGA NEBULA)",
  "image": {
    "large": "/Images/m17_050512_2000.jpg",
    "thumb": "/Images/m17_050512_800.jpg",
    "alt": "M17 (OMEGA NEBULA)",
    "survey": "P/DSS2/color",
    "fov": 25,
    "target": "M17"
  },
  "details": [
    {
      "label": "Object Notes",
      "text": "Constellation: Sagittarius\nLocation: RA: 18h 20m 48.0s Dec: -16d 11' 00\" Epoch 2000\nSize: 11 x 11 arc-minutes\nMagnitude: 6.0\nType: Diffuse Nebula/Open Cluster\nAKA: Omega Nebula, Swan Nebula, ngc6618",
      "links": []
    },
    {
      "label": "Instrument",
      "text": "Ritchey-Chretien 32\" Telescope",
      "links": [
        {
          "href": "/Equipment_RC32.php",
          "label": "Ritchey-Chretien 32\" Telescope"
        }
      ]
    },
    {
      "label": "Focal Ratio",
      "text": "f7.2 (prime focus)",
      "links": []
    },
    {
      "label": "Camera",
      "text": "SBIG STL-11000 CCD camera\n(See product review in July, 2004 issue of Sky & Telescope magazine.)",
      "links": [
        {
          "href": "http://www.sbig.com/sbwhtmls/large_format_cameras.htm",
          "label": "SBIG STL-11000 CCD camera"
        }
      ]
    },
    {
      "label": "Exposure",
      "text": "16 x 1 minutes Luminance unbinned\n6 x 15 minutes Hydrogen Alpha unbinned (Astrodon 6nm filter)\n8 x 1 minutes each R/G/B, all unbinned",
      "links": []
    },
    {
      "label": "Guiding",
      "text": "Off-Axis with STV Autoguider\n(Santa Barbara Instrument Group)\n(See product review in May, 2003 issue of Astronomy magazine.)\nSee Photo/Guiding Equipment.",
      "links": [
        {
          "href": "http://www.sbig.com",
          "label": "(Santa Barbara Instrument Group)"
        },
        {
          "href": "/Equipment_PhotoGuide.php",
          "label": "Photo/Guiding Equipment."
        }
      ]
    },
    {
      "label": "Date",
      "text": "5/12/05",
      "links": []
    },
    {
      "label": "Post Processing",
      "text": "CCDSoft, CCDSharp, MaxIM DL, Photoshop CS",
      "links": []
    }
  ],
  "galleries": [
    {
      "category": "nebulae",
      "order": 3,
      "link": "image_card/Nebulae_m17.php",
      "thumb": "/Images/m17_050512_100.jpg",
      "alt": "M17",
      "title": "Omega Nebula",
      "subtitle": "M17"
    }
  ]
}
