{
  "id": "Nebulae_Stock8_ic417",
  "category": "nebulae",
  "order": 52,
  "canonical_url": "/image_card/Nebulae_Stock8_ic417.php",
  "gallery": {
    "title": "Spider Nebula",
    "subtitle": "IC417",
    "thumb": "/Images/Stock8_ic417_040320_05_120m_bgsm_5_25_100.jpg",
    "alt": "IC417"
  },
  "title": "Astrophotography - ic417",
  "object": "IC417",
  "image": {
    "large": "/Images/Stock8_ic417_040320_05_120m_bgsm_5_25_800.jpg",
    "thumb": "/Images/Stock8_ic417_040320_05_120m_bgsm_5_25_800.jpg",
    "alt": "IC417",
    "survey": "P/DSS2/color",
    "fov": 25,
    "target": "IC417"
  },
  "details": [
    {
      "label": "Exposure",
      "text": "120 minutes",
      "links": []
    },
    {
      "label": "Date",
      "text": "3/20/04",
      "links": []
    },
    {
      "label": "Post Processing",
      "text": "Photographic Grain smoothed with Alex Mellinger's\nbgsmooth program.",
      "links": [
        {
          "href": "http://canopus.physik.uni-potsdam.de/~axm/bgsmooth.html",
          "label": "bgsmooth"
        }
      ]
    }
  ],
  "galleries": [
    {
      "category": "nebulae",
      "order": 52,
      "link": "image_card/Nebulae_Stock8_ic417.php",
      "thumb": "/Images/Stock8_ic417_040320_05_120m_bgsm_5_25_100.jpg",
      "alt": "IC417",
      "title": "Spider Nebula",
      "subtitle": "IC417"
    }
  ]
}
