{
  "id": "Nebulae_ic1318cn",
  "category": "nebulae",
  "order": 55,
  "canonical_url": "/image_card/Nebulae_ic1318cn.php",
  "gallery": {
    "title": "Central Portion Gamma Cygni Nebula",
    "subtitle": "IC1318",
    "thumb": "/Images/ic1318cn_040907_100.jpg",
    "alt": "IC1318"
  },
  "title": "Astrophotography - ic1318 (Central Portion)",
  "object": "IC1318 (CENTRAL PORTION - NEAR GAMMA CYGNI)",
  "image": {
    "large": "/Images/ic1318cn_040907_2000.jpg",
    "thumb": "/Images/ic1318cn_040907_800.jpg",
    "alt": "IC1318 (CENTRAL PORTION - NEAR GAMMA CYGNI)",
    "survey": "P/DSS2/color",
    "fov": 25,
    "target": "IC1318"
  },
  "details": [
    {
      "label": "Object Notes",
      "text": "Constellation: Cygnus\nLocation: RA: 20h 25m 08s Dec: 40d 19m 00s Epoch 2000\nType: Diffuse/Dark Nebula",
      "links": []
    },
    {
      "label": "Exposure",
      "text": "12 x 5 minutes Luminance unbinned\n4 x 5 minutes each R/G/B, all binned 3x3",
      "links": []
    },
    {
      "label": "Date",
      "text": "9/07/04",
      "links": []
    },
    {
      "label": "Post Processing",
      "text": "CCDSoft, CCDSharp, MaxIM DL, Photoshop CS",
      "links": []
    }
  ],
  "galleries": [
    {
      "category": "nebulae",
      "order": 55,
      "link": "image_card/Nebulae_ic1318cn.php",
      "thumb": "/Images/ic1318cn_040907_100.jpg",
      "alt": "IC1318",
      "title": "Central Portion Gamma Cygni Nebula",
      "subtitle": "IC1318"
    }
  ]
}
