{
  "id": "Clusters_m52",
  "category": "clusters",
  "order": 24,
  "canonical_url": "/image_card/Clusters_m52.php",
  "gallery": {
    "title": "Open Cluster of Cassiopeia",
    "subtitle": "M52",
    "thumb": "/Images/m52_050907_100.jpg",
    "alt": "M52"
  },
  "title": "Astrophotography - M52",
  "object": "M52",
  "image": {
    "large": "/Images/m52_050907_2000.jpg",
    "thumb": "/Images/m52_050907_800.jpg",
    "alt": "M52",
    "survey": "P/DSS2/color",
    "fov": 25,
    "target": "M52"
  },
  "details": [
    {
      "label": "Object Notes",
      "text": "Constellation: Cassiopeia\nLocation: RA: 23h 24m 12.0s Dec: +61d 35' 00\" Epoch 2000\nSize: 13.0 arc-minutes\nMagnitude: 6.9\nType: Open Cluster\nAKA: ngc7654",
      "links": []
    },
    {
      "label": "Exposure",
      "text": "16 x 1 minutes Luminance unbinned\n6 x 1 minutes each R/G/B, all unbinned",
      "links": []
    },
    {
      "label": "Date",
      "text": "9/07/05",
      "links": []
    },
    {
      "label": "Post Processing",
      "text": "CCDSoft, CCDSharp, MaxIM DL, Photoshop CS",
      "links": []
    }
  ],
  "galleries": [
    {
      "category": "clusters",
      "order": 24,
      "link": "image_card/Clusters_m52.php",
      "thumb": "/Images/m52_050907_100.jpg",
      "alt": "M52",
      "title": "Open Cluster of Cassiopeia",
      "subtitle": "M52"
    }
  ]
}
