{
  "id": "178ED_m16",
  "category": "178ed",
  "order": 1,
  "canonical_url": "/image_card/178ED_m16.php",
  "gallery": {
    "title": "Eagle Nebula",
    "subtitle": "M16",
    "thumb": "Images/m16_040621_100.jpg",
    "alt": "Eagle Nebula"
  },
  "title": "Astrophotography - m16 - Eagle Nebula",
  "object": "M16 (Eagle Nebula)",
  "image": {
    "large": "/Images/m16_040621_2000.jpg",
    "thumb": "/Images/m16_040621_800.jpg",
    "alt": "M16 (Eagle Nebula)",
    "survey": "P/DSS2/color",
    "fov": 25,
    "target": "M16"
  },
  "details": [
    {
      "label": "Instrument",
      "text": "Meade 178ED 7\" Apochromatic Refractor Telescope",
      "links": []
    },
    {
      "label": "Focal Ratio",
      "text": "f9 (prime focus)",
      "links": []
    },
    {
      "label": "Camera",
      "text": "SBIG STL-11000 CCD camera\n(See product review in July, 2004 issue of Sky & Telescope magazine.)",
      "links": [
        {
          "href": "http://www.sbig.com/sbwhtmls/large_format_cameras.htm",
          "label": "SBIG STL-11000 CCD camera"
        }
      ]
    },
    {
      "label": "Exposure",
      "text": "4 x 5 minutes Luminance, 2 x 5 minutes each R/G/B, all unbinned",
      "links": []
    },
    {
      "label": "Guiding",
      "text": "Off-Axis with STV Autoguider\n(Santa Barbara Instrument Group)\n(See product review in May, 2003 issue of Astronomy magazine.)\nSee Photo/Guiding Equipment.",
      "links": [
        {
          "href": "http://www.sbig.com",
          "label": "(Santa Barbara Instrument Group)"
        },
        {
          "href": "/Equipment_PhotoGuide.php",
          "label": "Photo/Guiding Equipment."
        }
      ]
    },
    {
      "label": "Date",
      "text": "6/21/04",
      "links": []
    },
    {
      "label": "Post Processing",
      "text": "CCDSoft, CCDSharp, MaxIM DL, Photoshop CS",
      "links": []
    }
  ],
  "galleries": [
    {
      "category": "178ed",
      "order": 1,
      "link": "/image_card/178ED_m16.php",
      "thumb": "Images/m16_040621_100.jpg",
      "alt": "Eagle Nebula",
      "title": "Eagle Nebula",
      "subtitle": "M16"
    }
  ]
}
