{
  "id": "178ED_m42",
  "category": "178ed",
  "order": 11,
  "canonical_url": "/image_card/178ED_m42.php",
  "gallery": {
    "title": "Orion Nebula",
    "subtitle": "M42",
    "thumb": "Images/m42_040913_100.jpg",
    "alt": "M42"
  },
  "title": "Astrophotography - m42 (Orion Nebula)",
  "object": "M42 (ORION NEBULA)",
  "image": {
    "large": "/Images/m42_040913_2000.jpg",
    "thumb": "/Images/m42_040913_800.jpg",
    "alt": "M42 (ORION NEBULA)",
    "survey": "P/DSS2/color",
    "fov": 25,
    "target": "M42"
  },
  "details": [
    {
      "label": "Instrument",
      "text": "Meade 178ED 7\" Apochromatic Refractor Telescope",
      "links": []
    },
    {
      "label": "Focal Ratio",
      "text": "f9 (prime focus)",
      "links": []
    },
    {
      "label": "Camera",
      "text": "SBIG STL-11000 CCD camera\n(See product review in July, 2004 issue of Sky & Telescope magazine.)",
      "links": [
        {
          "href": "http://www.sbig.com/sbwhtmls/large_format_cameras.htm",
          "label": "SBIG STL-11000 CCD camera"
        }
      ]
    },
    {
      "label": "Exposure",
      "text": "12 x 1 minutes Luminance unbinned\n6 x 1 minutes each R/G/B, all binned 3x3",
      "links": []
    },
    {
      "label": "Guiding",
      "text": "Off-Axis with STV Autoguider\n(Santa Barbara Instrument Group)\n(See product review in May, 2003 issue of Astronomy magazine.)\nSee Photo/Guiding Equipment.",
      "links": [
        {
          "href": "http://www.sbig.com",
          "label": "(Santa Barbara Instrument Group)"
        },
        {
          "href": "/Equipment_PhotoGuide.php",
          "label": "Photo/Guiding Equipment."
        }
      ]
    },
    {
      "label": "Date",
      "text": "9/13/04",
      "links": []
    },
    {
      "label": "Post Processing",
      "text": "CCDSoft, CCDSharp, MaxIM DL, Photoshop CS",
      "links": []
    }
  ],
  "galleries": [
    {
      "category": "178ed",
      "order": 11,
      "link": "/image_card/178ED_m42.php",
      "thumb": "Images/m42_040913_100.jpg",
      "alt": "M42",
      "title": "Orion Nebula",
      "subtitle": "M42"
    }
  ]
}
