{
  "id": "Nebulae_pk217p14v1",
  "category": "nebulae",
  "order": 71,
  "canonical_url": "/image_card/Nebulae_pk217p14v1.php",
  "gallery": {
    "title": "Planetary Nebula of Canis Minor",
    "subtitle": "PK217+14.1",
    "thumb": "/Images/pk217p14v1_050311_100.jpg",
    "alt": "PK217+14.1"
  },
  "title": "Astrophotography - pk217+14.1",
  "object": "PK217+14.1",
  "image": {
    "large": "/Images/pk217p14v1_050311_2000.jpg",
    "thumb": "/Images/pk217p14v1_050311_800.jpg",
    "alt": "PK217+14.1",
    "survey": "P/DSS2/color",
    "fov": 25,
    "target": "PK 217+14.1"
  },
  "details": [
    {
      "label": "Object Notes",
      "text": "Constellation: Canis Minor\nLocation: RA: 07h 51m 42.9s Dec:+03d 00' 15\" Epoch 2000\nSize: 265 x 180 arc-seconds\nMagnitude: 13.6\nType: Planetary Nebula\nAKA: Abell 24",
      "links": []
    },
    {
      "label": "Exposure",
      "text": "7 x 15 minutes Luminance unbinned\n4 x 5 minutes each R/G/B, all binned 3x3",
      "links": []
    },
    {
      "label": "Date",
      "text": "3/11/05",
      "links": []
    },
    {
      "label": "Post Processing",
      "text": "CCDSoft, CCDSharp, MaxIM DL, Photoshop CS",
      "links": []
    }
  ],
  "galleries": [
    {
      "category": "nebulae",
      "order": 71,
      "link": "image_card/Nebulae_pk217p14v1.php",
      "thumb": "/Images/pk217p14v1_050311_100.jpg",
      "alt": "PK217+14.1",
      "title": "Planetary Nebula of Canis Minor",
      "subtitle": "PK217+14.1"
    }
  ]
}
