{
  "id": "Nebulae_ngc6781",
  "category": "nebulae",
  "order": 37,
  "canonical_url": "/image_card/Nebulae_ngc6781.php",
  "gallery": {
    "title": "Snowglobe Nebula",
    "subtitle": "NGC",
    "thumb": "/Images/ngc6781_050710_100.jpg",
    "alt": "NGC"
  },
  "title": "Astrophotography - NGC 6781",
  "object": "NGC 6781",
  "image": {
    "large": "/Images/ngc6781_050710_2000.jpg",
    "thumb": "/Images/ngc6781_050710_800.jpg",
    "alt": "NGC 6781",
    "survey": "P/DSS2/color",
    "fov": 25,
    "target": "NGC6781"
  },
  "details": [
    {
      "label": "Object Notes",
      "text": "Constellation: Aquila\nLocation: RA: 19h 18m 23.9s Dec: +06d 33' 00\" Epoch 2000\nSize: 111 x 109 arc-seconds\nMagnitude: 11.8\nType: Planetary Nebula\nAKA: PK 41-2.1",
      "links": []
    },
    {
      "label": "Instrument",
      "text": "Ritchey-Chretien 32\" Telescope",
      "links": [
        {
          "href": "/Equipment_RC32.php",
          "label": "Ritchey-Chretien 32\" Telescope"
        }
      ]
    },
    {
      "label": "Focal Ratio",
      "text": "f7.2 (prime focus)",
      "links": []
    },
    {
      "label": "Camera",
      "text": "SBIG STL-11000 CCD camera\n(See product review in July, 2004 issue of Sky & Telescope magazine.)\nwith Astrodon Tru-Balance color filters.",
      "links": [
        {
          "href": "http://www.sbig.com/sbwhtmls/large_format_cameras.htm",
          "label": "SBIG STL-11000 CCD camera"
        },
        {
          "href": "http://www.astrodon.com",
          "label": "Astrodon"
        }
      ]
    },
    {
      "label": "Exposure",
      "text": "12 x 5 minutes Luminance unbinned,\n3 x 5 minutes each R/G/B, all unbinned",
      "links": []
    },
    {
      "label": "Guiding",
      "text": "Off-Axis with STV Autoguider\n(Santa Barbara Instrument Group)\n(See product review in May, 2003 issue of Astronomy magazine.)\nSee Photo/Guiding Equipment.",
      "links": [
        {
          "href": "http://www.sbig.com",
          "label": "(Santa Barbara Instrument Group)"
        },
        {
          "href": "/Equipment_PhotoGuide.php",
          "label": "Photo/Guiding Equipment."
        }
      ]
    },
    {
      "label": "Date",
      "text": "7/10/05",
      "links": []
    },
    {
      "label": "Post Processing",
      "text": "CCDSoft, CCDSharp, MaxIM DL, Photoshop CS",
      "links": []
    }
  ],
  "galleries": [
    {
      "category": "nebulae",
      "order": 37,
      "link": "image_card/Nebulae_ngc6781.php",
      "thumb": "/Images/ngc6781_050710_100.jpg",
      "alt": "NGC",
      "title": "Snowglobe Nebula",
      "subtitle": "NGC"
    }
  ]
}
